{"reportFormat":"CTRF","specVersion":"0.0.0","reportId":"99481e90-443c-4124-86d3-5537e6fc614b","timestamp":"2026-09-23T19:25:54Z","generatedBy":"Xunit.Runner.Common.CtrfResultWriterMessageHandler, xunit.v3.runner.common, Version=4.0.0.0, Culture=neutral, PublicKeyToken=8d05b1bb7a6fdb6c","results":{"tool":{"name":"xUnit.net v3","version":"4.0.0+8bf043c053"},"environment":{"osPlatform":"win32","osRelease":"Microsoft Windows 10.0.26200","osVersion":"Microsoft Windows 10.0.26200"},"extra":{"user":"runner","suites":[{"id":"e7c4f2284c1d30f017fbb2770d78d11af8dceb935d5f1fbd02fba3fb25b8d48a","filePath":"/home/runner/work/sample-target-9/sample-target-9/tests/SampleTarget.Timing.Tests/bin/Debug/net10.0/SampleTarget.Timing.Tests.dll","environment":"64-bit (x64) .NET 10.0.12 [collection-per-class, parallel (collections, 20 threads)]","testFramework":"xUnit.net v3 4.0.0+8bf043c053","targetFramework":".NETCoreApp,Version=v10.0","start":1790191554190,"stop":1790191554210,"duration":19,"collections":[],"errors":[]}]},"summary":{"tests":0,"passed":0,"failed":0,"pending":0,"skipped":0,"other":0,"suites":1,"start":1790191554190,"stop":1790191554210},"tests":[]}}