{"reportFormat":"CTRF","specVersion":"0.0.0","reportId":"65c2d83d-92eb-40cc-be4c-52128761dedd","timestamp":"2026-09-16T18:01:36Z","results":{"tool":{"name":"xUnit.net v3","version":"3.2.2+728c1dce01"},"environment":{"osPlatform":"Linux","osRelease":"Ubuntu 24.04.5 LTS"},"extra":{"user":"runner","suites":[{"id":"2aac40ba-41fd-4913-974d-a0b6b231b56d","filePath":"/home/runner/work/sample-target/sample-target/tests/SampleTarget.Tests/bin/Debug/net10.0/SampleTarget.Tests.dll","environment":"64-bit (x64) .NET 10.0.12 [collection-per-class, parallel (4 threads)]","testFramework":"xUnit.net v3 3.2.2+728c1dce01","targetFramework":".NETCoreApp,Version=v10.0","start":1789581695930,"stop":1789581696196,"duration":269,"collections":[{"id":"bedef595-e37a-4ca8-8ce5-0003e51520b4","name":"Test collection for SampleTarget.Tests.OutcomeTests (id: 10a4c0a0893da564a82f57522a1d7674769d939f63a051920b09cfae77de1235)"},{"id":"851b57a3-e7a3-4a92-a383-8193993da62c","name":"Test collection for SampleTarget.Tests.BehaviourTests (id: aec236427fec6ab308b944ec07df3df2868808474e7b3b64ca259025cce48b1c)"}],"errors":[]}]},"summary":{"tests":6,"passed":3,"failed":0,"pending":0,"skipped":3,"other":0,"suites":1,"start":1789581695930,"stop":1789581696196},"tests":[{"name":"SampleTarget.Tests.OutcomeTests.Beta","status":"passed","duration":82,"suite":"2aac40ba-41fd-4913-974d-a0b6b231b56d","filePath":"/home/runner/work/sample-target/sample-target/tests/SampleTarget.Tests/OutcomeTests.cs","line":11,"extra":{"id":"c4f2d0d7-178b-4d04-af91-0083fc3a80c6","collection":"bedef595-e37a-4ca8-8ce5-0003e51520b4","type":"SampleTarget.Tests.OutcomeTests","method":"Beta"}},{"name":"SampleTarget.Tests.OutcomeTests.Gamma","status":"passed","duration":0,"suite":"2aac40ba-41fd-4913-974d-a0b6b231b56d","filePath":"/home/runner/work/sample-target/sample-target/tests/SampleTarget.Tests/OutcomeTests.cs","line":14,"extra":{"id":"79882387-1ffe-45ac-9dcf-91d7cee79629","collection":"bedef595-e37a-4ca8-8ce5-0003e51520b4","type":"SampleTarget.Tests.OutcomeTests","method":"Gamma"}},{"name":"SampleTarget.Tests.OutcomeTests.Alpha","status":"passed","duration":0,"suite":"2aac40ba-41fd-4913-974d-a0b6b231b56d","filePath":"/home/runner/work/sample-target/sample-target/tests/SampleTarget.Tests/OutcomeTests.cs","line":8,"extra":{"id":"bc2fb91d-8e67-4d58-a77b-cb3b5cae7171","collection":"bedef595-e37a-4ca8-8ce5-0003e51520b4","type":"SampleTarget.Tests.OutcomeTests","method":"Alpha"}},{"name":"SampleTarget.Tests.BehaviourTests.SlowSuite","status":"skipped","duration":0,"suite":"2aac40ba-41fd-4913-974d-a0b6b231b56d","filePath":"/home/runner/work/sample-target/sample-target/tests/SampleTarget.Tests/BehaviourTests.cs","line":10,"extra":{"id":"3dd2c643-32c2-421c-a63f-ac9333b0f389","collection":"851b57a3-e7a3-4a92-a383-8193993da62c","type":"SampleTarget.Tests.BehaviourTests","method":"SlowSuite","reason":"slow_suite_minutes is 0"}},{"name":"SampleTarget.Tests.BehaviourTests.Flaky","status":"skipped","duration":0,"suite":"2aac40ba-41fd-4913-974d-a0b6b231b56d","filePath":"/home/runner/work/sample-target/sample-target/tests/SampleTarget.Tests/BehaviourTests.cs","line":36,"extra":{"id":"5c7b9b05-cfac-4bdb-879d-7ebeb998a660","collection":"851b57a3-e7a3-4a92-a383-8193993da62c","type":"SampleTarget.Tests.BehaviourTests","method":"Flaky","reason":"flaky_test is false"}},{"name":"SampleTarget.Tests.BehaviourTests.Hang","status":"skipped","duration":0,"suite":"2aac40ba-41fd-4913-974d-a0b6b231b56d","filePath":"/home/runner/work/sample-target/sample-target/tests/SampleTarget.Tests/BehaviourTests.cs","line":23,"extra":{"id":"5853fbe6-d102-4757-a363-fb370243cae4","collection":"851b57a3-e7a3-4a92-a383-8193993da62c","type":"SampleTarget.Tests.BehaviourTests","method":"Hang","reason":"hang_test is false"}}]}}