{"reportFormat":"CTRF","specVersion":"0.0.0","reportId":"b663ccf6-f4f1-4a18-8f27-65d5c8a3169f","timestamp":"2026-09-16T18:01:56Z","results":{"tool":{"name":"xUnit.net v3","version":"3.2.2+728c1dce01"},"environment":{"osPlatform":"Linux","osRelease":"Ubuntu 24.04.5 LTS"},"extra":{"user":"runner","suites":[{"id":"9f6382eb-2954-479d-99c2-24994c74326d","filePath":"/home/runner/work/sample-target/sample-target/tests/SampleTarget.Timing.Tests/bin/Debug/net10.0/SampleTarget.Timing.Tests.dll","environment":"64-bit (x64) .NET 10.0.12 [collection-per-class, parallel (4 threads)]","testFramework":"xUnit.net v3 3.2.2+728c1dce01","targetFramework":".NETCoreApp,Version=v10.0","start":1789581695931,"stop":1789581716217,"duration":20289,"collections":[{"id":"261e323a-01b4-4e84-a516-4da2b1de0894","name":"Test collection for SampleTarget.Timing.Tests.Duration20Seconds (id: a38703edc20167db5b6112c0a804b4a6eef6c9658579b8e071783f51131285f0)"},{"id":"d14ea827-f1a2-44df-b89e-00b390a3eb27","name":"Test collection for SampleTarget.Timing.Tests.Duration50Milliseconds (id: 31c2cb39e9559ee25c4ef8dab583911b10f48db6cc8c158dbcf1accd144473f4)"},{"id":"ff1a6501-b8a5-4693-9cab-c081e668c7ae","name":"Test collection for SampleTarget.Timing.Tests.Baseline (id: 29379a7cd91e25193a042f130f19850d2716be460f205fc08f5ae4c189f12069)"},{"id":"cafde857-d3cf-4e68-879b-efc2d96fb5c5","name":"Test collection for SampleTarget.Timing.Tests.Duration2Seconds (id: eea2bcce55ed3b199f34accc3e2ed317e2f865ccdb6a539703ab1599e1bfafc0)"}],"errors":[]}]},"summary":{"tests":4,"passed":4,"failed":0,"pending":0,"skipped":0,"other":0,"suites":1,"start":1789581695931,"stop":1789581716217},"tests":[{"name":"SampleTarget.Timing.Tests.Duration20Seconds.Takes20Seconds","status":"passed","duration":20133,"suite":"9f6382eb-2954-479d-99c2-24994c74326d","filePath":"/home/runner/work/sample-target/sample-target/tests/SampleTarget.Timing.Tests/KnownDurationTests.cs","line":25,"extra":{"id":"d0ad9649-15cc-419f-b015-bc329cbc4124","collection":"261e323a-01b4-4e84-a516-4da2b1de0894","type":"SampleTarget.Timing.Tests.Duration20Seconds","method":"Takes20Seconds"}},{"name":"SampleTarget.Timing.Tests.Duration50Milliseconds.Takes50Milliseconds","status":"passed","duration":189,"suite":"9f6382eb-2954-479d-99c2-24994c74326d","filePath":"/home/runner/work/sample-target/sample-target/tests/SampleTarget.Timing.Tests/KnownDurationTests.cs","line":13,"extra":{"id":"a4c57653-532e-454d-9266-a57ad00cf908","collection":"d14ea827-f1a2-44df-b89e-00b390a3eb27","type":"SampleTarget.Timing.Tests.Duration50Milliseconds","method":"Takes50Milliseconds"}},{"name":"SampleTarget.Timing.Tests.Baseline.Runs","status":"passed","duration":27,"suite":"9f6382eb-2954-479d-99c2-24994c74326d","filePath":"/home/runner/work/sample-target/sample-target/tests/SampleTarget.Timing.Tests/KnownDurationTests.cs","line":35,"extra":{"id":"d36d2f61-2e03-475e-a21c-6e538368d90d","collection":"ff1a6501-b8a5-4693-9cab-c081e668c7ae","type":"SampleTarget.Timing.Tests.Baseline","method":"Runs"}},{"name":"SampleTarget.Timing.Tests.Duration2Seconds.Takes2Seconds","status":"passed","duration":2124,"suite":"9f6382eb-2954-479d-99c2-24994c74326d","filePath":"/home/runner/work/sample-target/sample-target/tests/SampleTarget.Timing.Tests/KnownDurationTests.cs","line":19,"extra":{"id":"2e1812b0-15fd-4409-80b9-693aa7a0e9b5","collection":"cafde857-d3cf-4e68-879b-efc2d96fb5c5","type":"SampleTarget.Timing.Tests.Duration2Seconds","method":"Takes2Seconds"}}]}}